id,date,time,theme,title,content,internet_source,author
1,15.11.2023,14:30,Технологии,Открытие нового технологического центра,"В Сургуте состоялось торжественное открытие нового технологического центра, специализирующегося на разработке инновационных решений в области энергетики. Центр оснащен современным оборудованием и будет способствовать развитию технологического потенциала региона.",https://example.com/news1,Иван Петров
2,14.11.2023,10:15,Образование,Старт образовательной программы,"Начался прием заявок на участие в образовательной программе 'Инновационное предпринимательство'. Программа направлена на развитие навыков в области технологического бизнеса.",https://example.com/news2,Мария Иванова
3,13.11.2023,16:45,Инновации,Успешное внедрение проекта,"Резидент ИНТЦ успешно внедрил систему умного энергопотребления на крупном промышленном предприятии. Проект позволил сократить затраты на электроэнергию на 30%.",https://example.com/news3,Алексей Сидоров
4,12.11.2023,09:00,Сотрудничество,Международное партнерство,"Подписано соглашение о сотрудничестве с ведущим технологическим университетом Германии. Партнерство предусматривает обмен опытом и совместные исследовательские проекты.",https://example.com/news4,Елена Смирнова
5,11.11.2023,13:20,Достижения,Признание на федеральном уровне,"Проект резидента ИНТЦ получил высокую оценку на федеральном конкурсе инновационных разработок. Разработка в области искусственного интеллекта признана одной из самых перспективных.",https://example.com/news5,Дмитрий Козлов
